{
  "schema": "ggen-ecosystem/publication-evidence-case/v1",
  "id": "PUB-037",
  "title": "Existing package ownership collision is refused",
  "hypothesis": "Existing package ownership collision is refused",
  "acceptance_edge": "publication.ownership-collision",
  "evidence": [
    "package ownership collision"
  ],
  "expected": {
    "standing": "REFUSED",
    "reason": "OWNERSHIP_COLLISION"
  },
  "observed_source": "synthetic negative/control fixture",
  "authority_ceiling": "VERIFY",
  "falsifier": "classifier output differs from REFUSED[OWNERSHIP_COLLISION]",
  "semantic_fingerprint": "fp:publication:ownership-collision:REFUSED:OWNERSHIP_COLLISION"
}
