{
  "schema": "ggen-ecosystem/publication-evidence-case/v1",
  "id": "PUB-035",
  "title": "Stale producer is refused",
  "hypothesis": "Stale producer is refused",
  "acceptance_edge": "publication.stale-producer-sha",
  "evidence": [
    "producer sha drift"
  ],
  "expected": {
    "standing": "REFUSED",
    "reason": "PRODUCER_SHA_DRIFT"
  },
  "observed_source": "synthetic negative/control fixture",
  "authority_ceiling": "VERIFY",
  "falsifier": "classifier output differs from REFUSED[PRODUCER_SHA_DRIFT]",
  "semantic_fingerprint": "fp:publication:stale-producer-sha:REFUSED:PRODUCER_SHA_DRIFT"
}
